<?xml version="1.0" encoding="UTF-8"?>
<!ELEMENT orders (order*)>
<!ATTLIST order ID CDATA #REQUIRED>
<!ELEMENT order (goodsMsg,orderTime,consumerID,merchantID,recvOrder,checkPay,payTime,deliver)>
<!ELEMENT goodsMsg (good*)>
<!ATTLIST good goodID CDATA #REQUIRED>
<!ELEMENT good (count)>
<!ELEMENT count (#PCDATA)>
<!ELEMENT orderTime (#PCDATA)>
<!ELEMENT consumerID (#PCDATA)>
<!ELEMENT merchantID (#PCDATA)>
<!ELEMENT recvOrder (#PCDATA)>
<!ELEMENT checkPay (#PCDATA)>
<!ELEMENT payTime (#PCDATA)>
<!ELEMENT deliver (#PCDATA)>