<?xml version="1.0" encoding="UTF-8"?>
<!DOCTYPE orders SYSTEM "order.dtd">

<orders>
  <order ID="xdcs1504184548955">
    <goodsMsg>
      <good goodID="20142203744">
        <count>12</count>
      </good>
      <good goodID="201">
        <count>33</count>
      </good>
    </goodsMsg>
    <orderTime>2017-08-31 09:02:28</orderTime>
    <consumerID>user1504058025827</consumerID>
    <merchantID>user1504057858984</merchantID>
    <recvOrder>true</recvOrder>
    <checkPay>true</checkPay>
    <payTime>未支付</payTime>
    <deliver>true</deliver>
  </order>
  <order ID="xdcs1504185540685">
    <goodsMsg>
      <good goodID="20178899">
        <count>10</count>
      </good>
      <good goodID="201730022">
        <count>20</count>
      </good>
    </goodsMsg>
    <orderTime>2017-08-31 09:19:00</orderTime>
    <consumerID>user1504058025827</consumerID>
    <merchantID>lisi</merchantID>
    <recvOrder>false</recvOrder>
    <checkPay>true</checkPay>
    <payTime>未支付</payTime>
    <deliver>false</deliver>
  </order>
</orders>
